ID,Name,Rating,Reviews,URL,Description,Location
227,TPC Scottsdale - Champions Course,3.9,127,https://dynamic-media-cdn.tripadvisor.com/media/photo-o/14/90/e1/cd/tpc-scottsdale-champions.jpg?w=500&h=400&s=1,"Woven into the Sonoran Desert with stunning panoramic views of the McDowell Mountains, TPC Scottsdale boasts 36 holes of inspiring golf and upscale amenities that let everyday golfers experience ""…","Scottsdale, Arizona"
228,Creative Gateways Art Gallery Scottsdale,4.4,14,https://dynamic-media-cdn.tripadvisor.com/media/photo-o/1d/74/54/92/creative-gateways-art.jpg?w=500&h=-1&s=1,"Creative Gateways Art Gallery Scottsdale offers a unique fine art experience with eclectic art offerings from artists all over the world. We have an array of beautiful glass art, paintings, wall art…","Scottsdale, Arizona"
229,Huhugam Ki Museum,3.9,8,https://dynamic-media-cdn.tripadvisor.com/media/photo-o/03/68/c8/c7/hoo-hoogam-ki-museum.jpg?w=500&h=-1&s=1,Native American museum located on the Salt River Reservation.,"Scottsdale, Arizona"
230,Peoria Sports Complex,4.6,350,https://dynamic-media-cdn.tripadvisor.com/media/photo-o/06/b9/83/91/spring-training.jpg?w=500&h=-1&s=1,"Peoria Sports Complex was the first Major League Baseball spring training and player development facility in the country shared by two teams. Built in 1994, the San Diego Padres and Seattle Mariners…","Peoria, Arizona"
231,Honey Hive Farms,5.0,46,https://dynamic-media-cdn.tripadvisor.com/media/photo-o/2a/8c/a1/0e/best-local-raw-honey.jpg?w=500&h=400&s=1,"Raw Local Honey from Arizona? Honey Hive Farms is the place to visit. Come to our farm for our Try Before You Buy Honey Event. See you Saturday at 14611 North 83rd Ave, Peoria AZ 85381. Honey Hive…","Peoria, Arizona"
232,Paqua Park at Scorpion Bay Marina,3.0,2,https://dynamic-media-cdn.tripadvisor.com/media/photo-o/1d/68/a0/85/over-5000-square-feet.jpg?w=500&h=-1&s=1,You’ll run. You’ll jump. You’ll slide. You’ll bounce. You’ll fall . . . and get back up and do it all again! Paqua Park is a great way to beat the heat and have some fun. Located on Lake Pleasant …,"Peoria, Arizona"
233,Trilogy Golf Club at Vistancia,4.1,78,https://dynamic-media-cdn.tripadvisor.com/media/photo-o/2c/1a/69/a3/golf-course.jpg?w=500&h=-1&s=1,"Designed by Gary Panks, Trilogy Golf Club at Vistancia is one of Arizona's premier golfing destinations. With tees ranging from 5,573 yards to 7,259 yards, this 18-hole, par 72 championship golf course…","Peoria, Arizona"
234,Arizona Broadway Theatre,4.4,337,https://dynamic-media-cdn.tripadvisor.com/media/photo-o/0e/ad/4d/1d/your-server-will-be-right.jpg?w=500&h=400&s=1,"ABT Performing Arts Association, Inc. is a 501(c)(3) nonprofit organization and Arizona’s one-of-a-kind, award-winning, state-of-the-art professional theatre showcasing locally and nationally acclaimed…","Peoria, Arizona"
235,Deer Valley Petroglyph Preserve,4.3,128,https://dynamic-media-cdn.tripadvisor.com/media/photo-o/05/bc/32/ce/deer-valley-rock-art.jpg?w=500&h=-1&s=1,CLOSED FOR JUNE AND JULYREOPENING AUGUST 2025,"Glendale, Arizona"
